2025-12-02 07:31:01,995 - websocietysimulator - INFO - Start initializing Simulator
2025-12-02 07:31:01,995 - websocietysimulator - INFO - Using CacheInteractionTool
2025-12-02 07:31:01,995 - websocietysimulator - INFO - Initializing InteractionTool with data directory: /Users/hoshuhan/Documents/UCLA/CS245/coursework/AgentSocietyChallenge/data_processed
2025-12-02 07:31:02,920 - sentence_transformers.SentenceTransformer - INFO - Load pretrained SentenceTransformer: paraphrase-MiniLM-L6-v2
2025-12-02 07:31:05,047 - websocietysimulator - INFO - Simulator initialized
2025-12-02 07:31:05,068 - websocietysimulator - INFO - Loaded 400 task-groundtruth pairs
2025-12-02 07:31:05,069 - websocietysimulator - INFO - Agent class set
2025-12-02 07:31:05,069 - websocietysimulator - INFO - LLM set
2025-12-02 07:31:05,069 - websocietysimulator - INFO - Running simulation
2025-12-02 07:31:05,069 - websocietysimulator - INFO - Total tasks: 50
2025-12-02 07:31:05,069 - websocietysimulator - INFO - Running with 2 threads
2025-12-02 07:31:05,163 - chromadb.telemetry.product.posthog - INFO - Anonymized telemetry enabled. See                     https://docs.trychroma.com/telemetry for more information.
2025-12-02 07:31:05,237 - root - INFO - === Experiment config ===
2025-12-02 07:31:05,238 - root - INFO - Planning module: PlanningVoyagerCustom
2025-12-02 07:31:05,238 - root - INFO - Reasoning module: ReasoningIO
2025-12-02 07:31:05,238 - root - INFO - Memory module: MemoryDILU
2025-12-02 07:31:05,238 - root - INFO - Use pairwise rerank: True
2025-12-02 07:31:05,238 - root - INFO - ---- Task start ---- user_id=21a8f051d56cc52c00445121e36071ec  #cands=20
2025-12-02 07:31:05,251 - root - INFO - === Experiment config ===
2025-12-02 07:31:05,252 - root - INFO - Planning module: PlanningVoyagerCustom
2025-12-02 07:31:05,252 - root - INFO - Reasoning module: ReasoningIO
2025-12-02 07:31:05,252 - root - INFO - Memory module: MemoryDILU
2025-12-02 07:31:05,252 - root - INFO - Use pairwise rerank: True
2025-12-02 07:31:05,252 - root - INFO - ---- Task start ---- user_id=31606898c01676313ca73672815b7782  #cands=20
2025-12-02 07:31:05,622 - websocietysimulator - ERROR - Gemini API Exception: 429 Resource exhausted. Please try again later. Please refer to https://cloud.google.com/vertex-ai/generative-ai/docs/error-code-429 for more details.
2025-12-02 07:31:05,663 - websocietysimulator - ERROR - Gemini API Exception: 429 Resource exhausted. Please try again later. Please refer to https://cloud.google.com/vertex-ai/generative-ai/docs/error-code-429 for more details.
2025-12-02 07:31:08,949 - websocietysimulator - ERROR - Gemini API Exception: 429 Resource exhausted. Please try again later. Please refer to https://cloud.google.com/vertex-ai/generative-ai/docs/error-code-429 for more details.
2025-12-02 07:31:11,275 - websocietysimulator - ERROR - Gemini API Exception: 429 Resource exhausted. Please try again later. Please refer to https://cloud.google.com/vertex-ai/generative-ai/docs/error-code-429 for more details.
2025-12-02 07:31:12,593 - websocietysimulator - ERROR - Gemini API Exception: 429 Resource exhausted. Please try again later. Please refer to https://cloud.google.com/vertex-ai/generative-ai/docs/error-code-429 for more details.
2025-12-02 07:31:17,505 - websocietysimulator - ERROR - Gemini API Exception: 429 Resource exhausted. Please try again later. Please refer to https://cloud.google.com/vertex-ai/generative-ai/docs/error-code-429 for more details.
2025-12-02 07:31:30,140 - websocietysimulator - INFO - ✓ User profile keys: ['genre_preference', 'target_audience', 'enjoyment_level', 'series_preference']
2025-12-02 07:31:30,140 - websocietysimulator - INFO - ✓ Batch 1/4 (items 1-5) using keys: ['genre_preference', 'target_audience', 'enjoyment_level', 'series_preference']
2025-12-02 07:31:31,090 - websocietysimulator - INFO - ✓ User profile keys: ['art_style_preference', 'character_preference', 'theme_preference', 'plot_novelty']
2025-12-02 07:31:31,090 - websocietysimulator - INFO - ✓ Batch 1/4 (items 1-5) using keys: ['art_style_preference', 'character_preference', 'theme_preference', 'plot_novelty']
2025-12-02 07:31:36,256 - websocietysimulator - INFO - ✓ Batch 2/4 (items 6-10) using keys: ['art_style_preference', 'character_preference', 'theme_preference', 'plot_novelty']
2025-12-02 07:31:42,201 - websocietysimulator - INFO - ✓ Batch 2/4 (items 6-10) using keys: ['genre_preference', 'target_audience', 'enjoyment_level', 'series_preference']
2025-12-02 07:31:45,655 - websocietysimulator - INFO - ✓ Batch 3/4 (items 11-15) using keys: ['art_style_preference', 'character_preference', 'theme_preference', 'plot_novelty']
2025-12-02 07:31:49,258 - websocietysimulator - INFO - ✓ Batch 3/4 (items 11-15) using keys: ['genre_preference', 'target_audience', 'enjoyment_level', 'series_preference']
2025-12-02 07:31:52,944 - websocietysimulator - INFO - ✓ Batch 4/4 (items 16-20) using keys: ['art_style_preference', 'character_preference', 'theme_preference', 'plot_novelty']
2025-12-02 07:31:59,242 - websocietysimulator - INFO - ✓ Batch 4/4 (items 16-20) using keys: ['genre_preference', 'target_audience', 'enjoyment_level', 'series_preference']
2025-12-02 07:32:03,486 - root - INFO - RAW REASONING OUTPUT:
["36444040", "33033696", "11375796", "35425030", "18590059", "2691607", "24603", "25211861", "12387743", "26429283", "27839748", "31321081", "18044903", "27406717", "936905", "13588086", "19545687", "1793039", "4506584", "33534046"]

2025-12-02 07:32:03,487 - root - INFO - RANKED LIST BEFORE PAIRWISE (len=20)
2025-12-02 07:32:03,488 - root - INFO - Ranked list (pre-pairwise): ['36444040', '33033696', '11375796', '35425030', '18590059', '2691607', '24603', '25211861', '12387743', '26429283', '27839748', '31321081', '18044903', '27406717', '936905', '13588086', '19545687', '1793039', '4506584', '33534046']
2025-12-02 07:32:03,489 - root - INFO - [Pairwise] Reranking top 5 candidates (have 5 profiles)
2025-12-02 07:32:08,632 - root - INFO - RAW REASONING OUTPUT:
```python
["19253529", "18568536", "16131112", "22360", "30301048", "77395", "4114897", "33825959", "1920140", "3729701", "25817512", "15001657", "20702450", "295769", "3243495", "15984375", "552364", "7160009", "18142380", "11988532"]
```
2025-12-02 07:32:08,633 - root - INFO - RANKED LIST BEFORE PAIRWISE (len=20)
2025-12-02 07:32:08,633 - root - INFO - Ranked list (pre-pairwise): ['19253529', '18568536', '16131112', '22360', '30301048', '77395', '4114897', '33825959', '1920140', '3729701', '25817512', '15001657', '20702450', '295769', '3243495', '15984375', '552364', '7160009', '18142380', '11988532']
2025-12-02 07:32:08,633 - root - INFO - [Pairwise] Reranking top 5 candidates (have 5 profiles)
2025-12-02 07:32:12,419 - websocietysimulator - ERROR - Gemini API Exception: 429 Resource exhausted. Please try again later. Please refer to https://cloud.google.com/vertex-ai/generative-ai/docs/error-code-429 for more details.
2025-12-02 07:32:14,293 - websocietysimulator - ERROR - Gemini API Exception: 429 Resource exhausted. Please try again later. Please refer to https://cloud.google.com/vertex-ai/generative-ai/docs/error-code-429 for more details.
2025-12-02 07:32:16,757 - websocietysimulator - ERROR - Gemini API Exception: 429 Resource exhausted. Please try again later. Please refer to https://cloud.google.com/vertex-ai/generative-ai/docs/error-code-429 for more details.
2025-12-02 07:32:21,899 - root - INFO - RANKED LIST AFTER PAIRWISE (len=20)
2025-12-02 07:32:21,899 - root - INFO - Ranked list (post-pairwise): ['36444040', '33033696', '11375796', '35425030', '18590059', '2691607', '24603', '25211861', '12387743', '26429283', '27839748', '31321081', '18044903', '27406717', '936905', '13588086', '19545687', '1793039', '4506584', '33534046']
2025-12-02 07:32:21,899 - root - INFO - FINAL RANKED LIST (len=20)
2025-12-02 07:32:21,900 - root - INFO - Ranked list : ['36444040', '33033696', '11375796', '35425030', '18590059', '2691607', '24603', '25211861', '12387743', '26429283', '27839748', '31321081', '18044903', '27406717', '936905', '13588086', '19545687', '1793039', '4506584', '33534046']
2025-12-02 07:32:21,900 - root - INFO - ---- Task end ----
2025-12-02 07:32:21,901 - websocietysimulator - INFO - Simulation finished for task 0
2025-12-02 07:32:21,913 - root - INFO - === Experiment config ===
2025-12-02 07:32:21,914 - root - INFO - Planning module: PlanningVoyagerCustom
2025-12-02 07:32:21,914 - root - INFO - Reasoning module: ReasoningIO
2025-12-02 07:32:21,914 - root - INFO - Memory module: MemoryDILU
2025-12-02 07:32:21,914 - root - INFO - Use pairwise rerank: True
2025-12-02 07:32:21,915 - root - INFO - ---- Task start ---- user_id=d289f9033dc386bfe2301a1f7eda73b6  #cands=20
2025-12-02 07:32:22,236 - websocietysimulator - ERROR - Gemini API Exception: 429 Resource exhausted. Please try again later. Please refer to https://cloud.google.com/vertex-ai/generative-ai/docs/error-code-429 for more details.
